name,address,country,phone,website
Kinder Maternal,"Anselmo de la Portilla 52, Jardín Balbuena, Venustiano Carranza, 15900 Ciudad de México, CDMX, Mexico"," Mexico",campo no disponible,campo no disponible
ESTANCIA INFANTIL MAGICO MONTESSORI,"Calle Gral. Agustín Olachea Avilés 38, Adolfo López Mateos, Venustiano Carranza, 15670 Ciudad de México, CDMX, Mexico"," Mexico",campo no disponible,campo no disponible
INSTITUTO MONTESSORI,"Ote. 237 120, Agrícola Oriental, Iztacalco, 08500 Ciudad de México, CDMX, Mexico"," Mexico",55 5716 4701,https://www.institutomontessori.com.mx/
Bosques Montessori,"Rtno. Bosques de Vaduz 11, Bosques de Aragon, 57170 Cdad. Nezahualcóyotl, Méx., Mexico"," Mexico",55 1617 1216,campo no disponible
MONTE ROSA SCHOOL,"C. Genaro García 125, Jardín Balbuena, Venustiano Carranza, 15900 Venustiano Carranza, CDMX, Mexico"," Mexico",55 5552 4294,http://monte-rosa.mx/
MONTESSORI´S WORLD PRESCHOOL AND ELEMENTARY SCHOOL,"Tabasco 148, C. U. Benito Juárez, Roma Nte., Cuauhtémoc, 06700 Ciudad de México, CDMX, Mexico"," Mexico",55 5511 5198,http://montessorisworld.com/
Colegio de Educación Montessori,"Juan Sarabia 137, Nueva Santa María, Azcapotzalco, 02800 Ciudad de México, CDMX, Mexico"," Mexico",55 5355 2558,https://www.coledmontessori.com/
Instituto Montessori,"Iztapalapa, Modelo, 09089 Ciudad de México, CDMX, Mexico"," Mexico",55 5582 0353,campo no disponible
Montessori School Aragon,"Casas Aleman almost corner Av, Pto. Veracruz 22 Colonia, Pueblo de San Juan de Aragón, Gustavo A. Madero, 07580 Ciudad de México, CDMX, Mexico"," Mexico",55 5753 3683,http://montessoriaragon.com.mx/
MARIA MONTESSORI SCHOOL,"Av Progreso 190, Escandón I Secc, Miguel Hidalgo, 11800 Ciudad de México, CDMX, Mexico"," Mexico",55 5515 6706,https://www.colegiomm.edu.mx/
Centro Montessori Nextia,"Enrique Rébsamen 327, Narvarte Poniente, Benito Juárez, 03020 Ciudad de México, CDMX, Mexico"," Mexico",55 5639 3386,campo no disponible
Centro Infantil Montessori Pimpollo,"Londres 44, Juárez, Cuauhtémoc, 06600 Ciudad de México, CDMX, Mexico"," Mexico",campo no disponible,campo no disponible
Montessori Children´s School,"Maravatio 242, entre Heliópolis y Nilo, Claveria, Azcapotzalco, 02080 Ciudad de México, CDMX, Mexico"," Mexico",55 5396 4597,http://montchildrensschool.edu.mx/
Colegio María Montessori,"Av. Benjamín Franklin No. 164, Escandón I Secc, Miguel Hidalgo, 11800 Ciudad de México, CDMX, Mexico"," Mexico",55 5277 8214,http://mariamontessori.edu.mx/
Centro Montessori Tonali,"Trabajadores Sociales 249, El Sifón, Iztapalapa, 09400 Ciudad de México, CDMX, Mexico"," Mexico",campo no disponible,campo no disponible
Colegio Constructivista Maria Montessori - San Juan de Aragon,"Cjon. 5 de Mayo 30-26, San Juan de Aragón, Gustavo A. Madero, 07950 Ciudad de México, CDMX, Mexico"," Mexico",55 7600 6276,http://mariamontessori.mx/
Colegio Constructivista Maria Montessori,"Boulevar Bosque, De Las Naciones 48, Bosques de Aragon, 57170 Cdad. Nezahualcóyotl, Méx., Mexico"," Mexico",55 7374 9409,http://mariamontessori.mx/
Colegio Ma Montessori Escandon A.C.,"Av. José Martí 240, Escandón I Secc, Miguel Hidalgo, 11800 Ciudad de México, CDMX, Mexico"," Mexico",55 5271 5965,https://www.colegiomm.edu.mx/
Montessori Oriente,"Ote 245B 179, Agrícola Oriental, Iztacalco, 08500 Ciudad de México, CDMX, Mexico"," Mexico",55 1005 5695,campo no disponible
IL MIO MONDO MONTESSORI,"Calz. Gral. Mariano Escobedo 117, Anáhuac I Secc, Miguel Hidalgo, 11320 Ciudad de México, CDMX, Mexico"," Mexico",55 5386 0794,http://www.ilmiomondom.com/
Canadian Montessori,"Eje 3 Nte. Camarones 232, Obrero Popular, Azcapotzalco, 02840 Ciudad de México, CDMX, Mexico"," Mexico",55 5341 7705,campo no disponible
Bilingue Montessori Educational Center Domani,"S. Lorenzo 174, Tlacoquemecatl del Valle, Benito Juárez, 03200 Ciudad de México, CDMX, Mexico"," Mexico",55 5575 5052,https://www.montessoridomani.edu.mx/
Montessori Calmecac,"Av. Emperadores 22, Col, Portales Oriente, Benito Juárez, 03570 Ciudad de México, CDMX, Mexico"," Mexico",55 5539 2096,https://sites.google.com/view/escuelamontessoricalmecac/p%C3%A1gina-principal
Montessori de la Condesa (Preschool and Primary),"Aguascalientes 190, Hipódromo, Cuauhtémoc, 06100 Ciudad de México, CDMX, Mexico"," Mexico",55 5574 6537,http://www.mdlc.com.mx/
Haikú. Casa de Nińos Montessori,"C. Pitágoras 567, Narvarte Poniente, Benito Juárez, 03020 Ciudad de México, CDMX, Mexico"," Mexico",55 3148 2349,campo no disponible
Villa Montessori,"07020, Unión 281, Tepeyac Insurgentes, Gustavo A. Madero, Ciudad de México, CDMX, Mexico"," Mexico",55 5577 6235,https://www.villamontessori.edu.mx/
Instituto Pedagógico María Montessori,"C. 34 # 4, El Sol, 57200 Cdad. Nezahualcóyotl, Méx., Mexico"," Mexico",55 5743 3075,campo no disponible
IL MIO MONDO MONTESSORI,"Hegel 205, Polanco, Polanco V Secc, Miguel Hidalgo, 11560 Ciudad de México, CDMX, Mexico"," Mexico",55 2624 0236,http://www.ilmiomondom.com/
Cedi Montessori,"Volcán Ceboruco 7, Pradera I Secc, Gustavo A. Madero, 07500 Ciudad de México, CDMX, Mexico"," Mexico",campo no disponible,campo no disponible
INSTITUTO INTERNACIONAL MONTESSORI SC,"Dallas 59, Nápoles, Benito Juárez, 03810 Ciudad de México, CDMX, Mexico"," Mexico",55 6382 9260,http://www.facebook.com/Instituto-Internacional-Montessori-1629237770668366/?fref=ts
Montessori Children´S School,"Calle Texcoco No. 161, Claveria, Azcapotzalco, 02080 Ciudad de México, CDMX, Mexico"," Mexico",55 7392 3908,https://www.montchildrensschool.edu.mx/principal.asp
Calli Nenets Montessori,"Torres Adalid 626, Col del Valle Centro, Benito Juárez, 03103 Ciudad de México, CDMX, Mexico"," Mexico",55 5687 6171,http://www.nenetcalli.edu.mx/
Montessori Kalpilli,"Calle Av. Dos 48, San Pedro de los Pinos, Benito Juárez, 03800 Ciudad de México, CDMX, Mexico"," Mexico",55 4888 5013,http://kalpilli.com/
Montessori Baby´s House,"Guanabana 331, Hogar y Seguridad, Azcapotzalco, 02800 Ciudad de México, CDMX, Mexico"," Mexico",55 5556 3158,campo no disponible
Colegio Hampton,"Jesús, Av. Jesús G. Y Villa 205 Col, Jardín Balbuena, Venustiano Carranza, 15900 Ciudad de México, CDMX, Mexico"," Mexico",55 2643 5252,http://colegiohampton.edu.mx/
Maria Montessori Preschool,"Av. Riva Palacio 161, Estado de Mexico, 57210 Cdad. Nezahualcóyotl, Méx., Mexico"," Mexico",55 5735 2967,campo no disponible
"Nenet Calli Montessori, S.C.","C. Tlacoquemecatl 69, Col del Valle Centro, Benito Juárez, 03100 Ciudad de México, CDMX, Mexico"," Mexico",55 5575 4100,http://nenetcalli.edu.mx/
Instituto Montessori,"Av. Pdte. Plutarco Elías Calles 1747, Portales Oriente, Benito Juárez, 03570 Ciudad de México, CDMX, Mexico"," Mexico",campo no disponible,https://www.institutomontessori.com.mx/
Jardin De Nińos Grety Bon,"Eduardo Molina 404, Michoacana, Venustiano Carranza, 15240 Ciudad de México, CDMX, Mexico"," Mexico",55 5789 6418,https://www.jngretybon.com/
Yayatia Montessori,"Roberto Gayol 23, DEL VALLE, Benito Juárez, 03100 Ciudad de México, CDMX, Mexico"," Mexico",55 5559 9400,campo no disponible
"Asociacion Montessori De Mexico, A.C.","Calle Av. Dos 48, San Pedro de los Pinos, Benito Juárez, 03800 Ciudad de México, CDMX, Mexico"," Mexico",campo no disponible,campo no disponible
Maria Montessori,"Colima Esquina Calle Juan de la Barrera 22, Guadalupe del Moral, Iztapalapa, 09300 Ciudad de México, CDMX, Mexico"," Mexico",campo no disponible,campo no disponible
Montessori Calmecac,"Calz. de Tlalpan 1150, Portales Nte, Benito Juárez, 03540 Ciudad de México, CDMX, Mexico"," Mexico",222 127 8563,https://montessoricalmecac.com/
Chiaravalle Montessori Preschool,"Amacuzac 369 Hermosillo Churubusco, Amacuzac 369, Hermosillo, Coyoacán, 04240 Ciudad de México, CDMX, Mexico"," Mexico",55 5544 1282,http://colegiochiaravallemontessori.edu.mx/
Ernestina CENDI Lattour,"Al interior del Mercado Balbuena, Retorno 29 Fray Servando Teresa de Mier SN, Jardín Balbuena, 15900 Venustiano Carranza, CDMX, Mexico"," Mexico",55 5785 3860,campo no disponible
CEIM - Centro Educativo Infantil Monterrey,"Amores 805, Del Valle, Benito Juárez, 03100 Ciudad de México, CDMX, Mexico"," Mexico",55 5669 1122,http://www.ceim.edu.mx/
Gabbiano MONTESSORI,"Primera Cda. Guadalajara 54, Roma Nte., Cuauhtémoc, 06700 Ciudad de México, CDMX, Mexico"," Mexico",55 5264 0219,campo no disponible
Montessori El Rincon Infantil,"Carreteraco 102, San Lucas, Coyoacán, 04030 Ciudad de México, CDMX, Mexico"," Mexico",55 5689 5121,http://elrinconinfantil.com/
Jardin De Nińos Boston,"C. Genaro García 283, Jardín Balbuena, Venustiano Carranza, 15900 Ciudad de México, CDMX, Mexico"," Mexico",55 5784 7015,campo no disponible
Sociedad Afiliada México A.C.,"Patricio Sanz 442, Col del Valle Nte, Benito Juárez, 03103 Ciudad de México, CDMX, Mexico"," Mexico",55 5615 8031,http://www.montessorimx.com/
Kinder María Montessori,"Fuentes, C. Tonatico 309, Raul Romero, 57600 Cdad. Nezahualcóyotl, Méx., Mexico"," Mexico",55 3910 9351,campo no disponible
Curso Montessori,"Calle Av. Dos, San Pedro de los Pinos, Benito Juárez, 03800 Ciudad de México, CDMX, Mexico"," Mexico",campo no disponible,campo no disponible
Montessori Babys House,"C. Toronja No. 220, Nueva Santa María, Azcapotzalco, 02800 Ciudad de México, CDMX, Mexico"," Mexico",campo no disponible,campo no disponible
Didactifomi,"Mesones 122, Centro Histórico de la Cdad. de México, Centro, Cuauhtémoc, 06090 Ciudad de México, CDMX, Mexico"," Mexico",55 7460 8661,campo no disponible
COCOMO (Montessori),"Culiacan 86, Hipódromo, Cuauhtémoc, 06100 Ciudad de México, CDMX, Mexico"," Mexico",55 7159 3166,campo no disponible
Official high 198 María Montessori,"Calle 22 esq. Av. Oaxaca s/n, Juárez Pantitlan, Cdad. Nezahualcóyotl, Méx., Mexico"," Mexico",campo no disponible,https://montessoritm.wixsite.com/mariamontessorimt
Colegio América,"Retorno 15 de Jesús, Av. Jesús G. Y Villa 15, Jardín Balbuena, Venustiano Carranza, 15900 Ciudad de México, CDMX, Mexico"," Mexico",55 5571 1326,campo no disponible
Colegio Montessori del Bosque,"Gobernador Tiburcio Montiel 25 A, San Miguel Chapultepec I Secc, Miguel Hidalgo, 11850 Ciudad de México, CDMX, Mexico"," Mexico",55 5515 1534,http://www.montessoridelbosque.com/
"Jardin De Ninos ""Apple Tree"" Maria Montessori","Leyes de Reforma 1ra Secc, 09310 Iztapalapa, CDMX, Mexico"," Mexico",campo no disponible,campo no disponible
Chiaravalle Montessori School,"Cerro San Francisco 295, Campestre Churubusco, Coyoacán, 04200 Ciudad de México, CDMX, Mexico"," Mexico",55 6819 4470,http://colegiochiaravallemontessori.edu.mx/
